Title,Details,Status
"Tax Audit (PP36, P51, P50)",Prepare documents and review tax filings for PP36,open
Sink Repair,Schedule and oversee repair of sink infrastructure,open
Empty Grease Trap,Coordinate grease trap emptying service,open
Transaction Tracker November,Complete transaction tracking for November - Type and Description fields for Current and Savings accounts,open
Transaction Tracker December,Keep December transaction tracker up-to-date with all entries,open
WHT Documents Q4,Send out WHT documents for September October and November,open
Introduce Free Snack 2025,Plan and implement free snack program starting 2025 including budget and logistics,open